{
  "schemaVersion": "1.0.0",
  "tenantId": "018f47c2-4a3b-7a10-8a11-000000000001",
  "projectId": "018f47c2-4a3b-7a10-8a11-000000000002",
  "sourceKind": "ASSET_VERSION",
  "sourceIdentity": "018f47c2-4a3b-7a10-8a11-000000000003",
  "sourceRevision": 7,
  "inputManifestSemanticDigest": "b7df166155e28ed511d0be6d51715f78d8e74e39dafb838ae117791183981f9c",
  "executionStage": "MEDIA_ANALYSIS",
  "capability": "SEGMENTATION",
  "partitionPolicy": "BY_TIME_RANGE",
  "partitionPolicyDigest": "e6e30ba21801141f091c89062c0cf8388bc2318446efad01093924aa712f79c7",
  "plannerKey": "default-planner",
  "plannerVersion": "1.0.0",
  "plannerReleaseDigest": "1802c665a3d214eabcb0e79daa48cfeb5bfcbd5db48ef772be660d3b148d1fc9",
  "executionProfileDigest": "577c62d359549814327855831f7733bd4916b24c52ddcd63c7a1bbb60b8e9c26",
  "outputSchemaDigest": "0db08be56afb935c4ead04578ad95e62bc66ba6a155cfd6249836fb22d7ef5ea",
  "modelDigest": "541702c7741adf4716adf482bbcb424946c38a7c710d62a79223a7f16162b68a",
  "configDigest": "a600435d3ce0ca4d6c7a1457a4aaa27917cf3a6637da2e7bc64e2228bb5e15c6",
  "policyDigest": "9ec63a396faf3069a6b7727af173130177c50bae6d56813d4c8a44bc4e8fbac5",
  "rightsFenceDigest": "33d2a6ccaa81161715823d03888ad998047ae6b04e1d7f62906d10c2190e46fb",
  "denylistFenceDigest": "caa157c69d386e790905243716e4c5792aec58a0e6ca039e06d9c00c4724fb5b",
  "derivativeFenceDigest": "5aced1b7719eb66c315e2ce8361071405815fcbc0e1cf88051f9ae94db42eed5",
  "backendEligibilityDigest": "b8953ac1adae9e573ee12f7bf9affd7188964dabad8b5923b3f1e2757cb24537",
  "dataPlaneEligibilityDigest": "f9e0d9aee8dc49abd69f2ad4d3551816ed9bfdf4a963bff8d3c5fd69c957c18c",
  "retryPolicyDigest": "ce600c12632ace683a3455538a4255e58be1e311565b95157740a9fd099330b4",
  "checkpointPolicyDigest": "c4ebaeea22944cc9ace33b1557efa6f8dac4b530d14315bc3e3a608e78fe2245",
  "reducerContractDigest": "106b7ba69a7d079e78dfcbfb5a706145cfbdb02e8cfeaf1502ea774ad2fcdc01",
  "priorityClass": "STANDARD",
  "costBudgetDigest": "9b04d7bbfc9c79d8f5bcdb2493414691201424c1dc93296023f353e16088ca55",
  "finalizationMode": "WORLD_COMMIT_LAST",
  "planRequestDigest": "84f464123497aabc85c3b273eed339f5e092a69941ef6da5a895ce54d41cc41c"
}
